text	label
我自己曾被突然窜出的行人吓的紧急煞车，停车后，心中砰砰直跳，而那人依然一副若无其事的样子，气的真想骂人。	[]
我曾经开车到马鞍山的采石矶游玩，车停在停车场，出来时，没有检查。	[26]
到家停妥后，才绕车一周看看。	[26]
结果惨了，车头竟然被撞瘪了一块，再回马鞍山找停车场已不可能，只有自认倒霉，只是那个采石矶的停车场收了钱，却不负责任的保管车辆，对我们外地车也太不厚道了。	[26]
停车当然要规规矩矩，以免妨碍他人遭人破坏，可也有的车主规规矩矩的停车，也惨遭破坏。	[]
"朋友一辆切诺基，屁股后面有着醒目的金属的字样""4×4""，并以此而骄傲。"	[]
"停在楼下，没想到，被一个热爱数学的小朋友，在4×4后面用硬物刻上""＝16""。"	[]
答案无疑是正确的，不过填空的位置好像不对。	[]
朋友买了车，却很少使用，问其原因，上班骑自行车不过几分钟，开车往往超过几分钟，加上在地下室看到那紧张的车位，就怕碰坏了车，回家还是停车困难，所以干脆不开了。	[]
只是周末或是长假开车出去旅游。	[]
今年五一，新的道路交通法实行了，比以前严格了许多，所以开车最怕的还是警察，还有那些无处不在的摄像头，稍不注意就被爆光。	[]
问题还不在这里，倘若正好被警察逮了个现行，也就罢了。	[]
"偏偏你往往不知道自己何时何地犯过""案""，等你车年检时，警察出示了违章照片，证据确凿，赖也赖不掉，乖乖接受多重处理。"	[]
今天，私家车这种个人代步工具的拥有量越来越大，全国私家车保有量已超过1200万辆，在南京，私家车的保有量的也达到近10万辆。	[]
私家车的增多对南京人的生活产生了巨大的影响，有车一族开着私家车上下班、访客、购物、出行，缩短了时间和空间，带来了无数的方便。	[]
车价的不断下落更勾起市民的购车欲望，据报载南京5％的家庭计划在三年内买车，有车一族还在不断地扩大。	[32, 32]
有车一族文/无事佬朋友J君的本本领了好几年，可就是没车开。	[]
那天打电话告诉我，买车了。	[7, 32]
并说接我出去玩玩，那天早上，他还真的来了，转了一天，晚上回家，绕城公路，车开的贼快，我劝他慢点，他说，技术好，没问题，还好一路无事。	[]
送我回家，进了小区大门，我要下车，他非要车送我到楼梯口，我说路窄，又是晚上，不大好调头，他说没事。	[26, 26]
至楼梯口，下车道别回家。	[26]
进家门十来分钟，电话响了，是J君的。	[26, 7]
"""安全到家了？"	[26]
"""我问。"	[]
"""老兄，你赶紧下来帮忙，我出不去了。"	[]
"""J君嚷到。"	[]
下楼，只见J君一头大汗，半天也没把车折腾出去。	[]
没办法，只好帮他推了几个来回，总算让车出去了。	[]
真是人为车所累啊。	[]
打桥牌我的业余爱好（1）看了几位谈起业余爱好的帖子，想起了自己。	[]
我的业余爱好很多，涉及面极广，不过有深浅之分，一个对生活充满着爱和不断追求的人，因为他不断的追求，不断的更新，因此他是永远年轻的，同样因为他有着无数的业余爱好，因此他不仅年轻，而且生活的一定很充实。	[]
打桥牌我爱打桥牌，是在中学是学会的，暑假没事，和一帮老教授学的，都是说英文，非常正宗。	[]
后来当兵去了，下里巴人多，桥牌无人会。	[]
再后来到地方工作，也还是阳春白雪，和者甚寡。	[]
八十年代，邓大人酷爱桥牌，其对门是铁道部长丁关根，所以丁部长受益匪浅。	[]
为了附属文雅，我们的局长也来学了，于是我成了老师，后来也常常参加省里的比赛，我和单位一大学生成对，每每都有名次。	[]
再后来，铁路出大事故，撞死了好多日本人，丁部长的位置干不成了，被迫辞职，因有桥牌基础，被降为政治局委员，中宣部部长（越降越大），现在还在任。	[22, 28, 30]
我们的局长也上去了，现在成了国家海关总署的副署长，现在还在任。	[30]
我也上去了，现在还是那时的职务。	[]
牌翁之意不在牌，而在于位子也。	[]
我一心摆在在牌上，尽管老是赢牌，没用！	[]
不过我真的得到不少奖品，每次夺冠，至少也是第二。	[]
五一刚刚参加省里的友谊塞，又是第二名。	[]
打了这么多年桥牌，牌艺精了，却始终领会不到牌中的艺术。	[]
我还是爱桥牌。	[]
放假了，是我上大学后的第一个暑假，读了十几年书，每次暑假，不是作业，就是用期待和焦急的心情等待中考或是高考的消息。	[]
现在不需要了，每门都过去了，我自由了！	[]
在珠江路打工文/南京无事佬放假了，是我上大学后的第一个暑假，读了十几年书，每次暑假，不是作业，就是用期待和焦急的心情等待中考或是高考的消息。	[]
现在不需要了，每门都过去了，我自由了！	[]
老爸让我去打工，说是搞点社会实践，我也想去，是想搞点钞票。	[]
老爸通过他的朋友，在珠江路联系了一家电脑公司，正好是我学习的专业，我去了。	[]
都说北有中关村，南有珠江路，珠江路的电脑公司多如牛毛。	[]
我去的这家老板是个女的，三十多岁，要了我的身份征复印件和简历，老板说，看你是朋友介绍来的，就不收你实习费了！	[]
天啦！	[]
老爸是怎么跟人说的？	[]
看来没钱拿了！	[]
第一天上班的下午，老板就派我到客户家去装机。	[26]
气象预报38度，实际外面更高，我一人带着三、四个箱子包装的电脑，打车去了。	[]
还真不好找，我只得用我的手机联系，是在六搂！	[]
我按下防盗门的通话键，客户不肯下来，我也不敢分几次上楼，怕东西丢了，只得一次把几个箱子一起弄上去，累得我气喘吁吁。	[26]
进门后，对我来说就简单了，一下就OK！	[]
回公司，只得用我老爸给我卖的月票啦！	[26]
老板不管报销的。	[]
下班后，老爸问我怎么样，我说了事情经过，老爸阴深深的说，呵呵，你知道嘛？	[]
自从你去，老板就辞了两个农民工。	[28]
打车费呢？	[]
还好，老板报销了，你就慢慢学着点吧。	[]
第二天上班，老板让我去长途车站托运主板，比头一天轻多了，我冒着酷暑干完了。	[26]
第三天上班，老板还是让我去车站托运散件，和第二天差不多，我冒着酷暑又干完了。	[26]
以后几天上班，我不是被派出去托运就是到别的公司送货、取货，大太阳底下，我跑来跑去，回家全身就像散了架子。	[26, 26, 26]
这也算了，老板每次都是让我先垫钱托运，而后报销，我一个穷学生，实在是垫不起了。	[]
而最最可恨的是，她不让我有时间接触电脑硬件，即使没事，也让我在门口拉客，我什么也没学到！	[]
我倒真有点相信自己是农民工了。	[]
半个月后，老妈生气了，说是东西没学到，书也没看成，不干了！	[]
老爸皮笑肉不笑的说，呵呵，你这是学到的资本家如何剥削工人的第一课，我看你在家什么也不干，到老板那里，就全干了，而且一分钱也没有！	[]
剥削有理呀。	[]
你的下一课，就是学习！	[]
真正的学习！	[]
我真的去和老板辞了，老板屁也没放一个，当然钱也没给一文。	[28]
算算十几天下来，我倒贴了几十元（在外送货的交通费、电话费、冷饮费）！	[]
老爸也是说到做到，第二天，我又到珠江路另一家公司打工，是一家著名的大公司呀！	[30]
不过还是说好没钱。	[]
第一天上班，报完到就让我回家，要穿浅色衬衣，要穿长裤，衣服要系在裤腰里，要穿皮鞋，就差戴领带了。	[26]
可我是圆领体恤，中裤加凉鞋。	[]
得！	[]
我回家就换！	[26]
第二天，我穿着整齐，一身笔挺，自己都感到精神抖擞，上班去了。	[]
这是大公司，活也多，我经常和他们一起外出装机，一装就是上百台。	[]
爽啊！	[]
真个叫爽！	[]
我去了半个月，到外地也去了好几次，这工，打的值！	[26]
不过好景不长了，老爸说是只打一个月，后面还要再家看书。	[]
不过也不错，每次外出，都有出差费，一次五十元，够意思。	[]
我还从来没在外面挣过钱，这完全是自个儿赚的钱！	[]
一个月的打工很快就过去了，我不仅赚了钱，而且还学会了许多许多，真的。	[]
非典必将倒下，城市精神永存！	[]
一从非典疫区返宁的普通市民要求隔离检查竟然无望文/南京无事佬昨天，看了一则电视消息，是南京台法制园地的主持人东方和一个被隔离者通电话。	[26, 7]
这位被隔离的普通市民是4月25日从北京出差返宁，处于对他人和对自己的高度负责，联系要求被隔离检查，竟然屡遭拒绝。	[26]
在没有办法的情况下，他只好找了家偏僻的小旅馆住下来，让家人和有关方面联系。	[]
直到5月3日，才被安排隔离检查。	[]
其间，这位有责任感的市民用日记的方式记下了几天的种种遭遇，暴露出我们某些防非典的专业部门和人员的失职和冷漠以及管理上的漏洞。	[]
主持人说，那段播放的电话录音已经作了处理，也就是说一些不大好公布的东西被隐去了。	[7]
但是，我还是听到这位有责任感市民的话：我多次电话联系都没人理我；	[7]
我威胁要到市政府大门去反映，才有人理我；	[]
我被隔离的所在医院的垃圾和污水处理不大好；	[]
如果我有幸未得非典，我要到你们法制园地做客，细说这几天的经历；	[]
......向这位不知名的市民致敬！	[]
要是每个官员，每个专门防非典的的部门和人员，每个市民都能这样，非典决不会在南京泛滥！	[]
非典必将倒下，城市精神永存！	[]
2003-5-7。	[]
打架（上）～文革系列故事之十一九一三林彪事件以后，在上海，我们海军不吃香了，连上海的文攻武卫，都仗着四人帮的势力，欺负我们。	[]
刚好我们舰进厂大修，是一个满是上海人的军工厂。	[]
我们的军舰在厂里，人是住在厂对门的部队大院里，两门之间一条小路，相距不足十米。	[]
每天进厂不着军服就要带证件，出厂如带东西还要让那些文攻武卫检查，特别是一个被我们称作白麻子的家伙，最可恶，一天到晚怀疑我们偷了厂里的东西。	[26, 26]
战士们都是二十岁左右血气方刚的小伙子，本来就是一肚子气，谁受的了？	[]
！	[]
于是经常吵架。	[]
战士小C，就是想整整那些趾高气扬的文攻武卫家伙。	[]
那天，下班出厂，他夹了个纸包，鬼鬼祟祟的经过厂门，白麻子火眼金睛，一下就喊住了他，过来检查，小C故意不肯，白麻子非要检查，双方争执起来，结果围了一大群看热闹的战士。	[26, 26]
小C假装不得不递过去的样子，白麻子骄傲的接过来，呆着胜利的微笑，揭开一层纸，里面还有纸包着，又揭开一层纸，一共揭开四五层纸，最后里面是快破转头！	[]
众战士哄然大笑！	[]
"被戏弄的白麻子气的脸红脖子粗，""你，你这是什么意思？"	[]
！	[]
"""""我没意思，找块转头垫床。"	[]
"""白麻子想动手了，后被拉住，没打起来。"	[4, 4]
但是还是结下了梁子。	[]
"本坛讯：西祠""市民论坛""第一次代表大会昨日（15日）在宁开幕，同日闭幕。"	[6]
"第一次""市民论坛""代表大会昨日在宁开幕，同日闭幕本坛讯：西祠""市民论坛""第一次代表大会昨日（15日）在宁开幕，同日闭幕。"	[6, 6]
金铁歌致开幕词，无事佬致闭幕词，代表们就市民论坛的定位、发展和前景充分发表了意见和建议。	[]
大会在代表们的面红耳赤中闭幕。	[6]
"昨天下午6点，在南京快乐人家酒店，""市民论坛""第一次代表大会隆重开幕。"	[6]
金铁歌第一个到达会场，时间是6点不到，立马给无事佬打电话，无事佬尚在车上，5分钟后，无事佬亦到场。	[7]
两人素不相识，依然是用手机联系，结果发现彼此相距不到5米。	[7]
寒暄后，金铁歌给HERO和YAGOO打电话，靠！	[7]
虽然近在尺尺的新街口，居然打车无门。	[]
只得相等。	[]
无事佬给简约发短信，简约回复，稍后即到。	[7, 7]
6点半左右，YAGOO和HERO同车到达。	[]
"因为简约有言在先，7点才能到，于是四人围着桌子四边开始""市民论坛""历史上的第一次代表大会。"	[6]
桌子中间是个大洞，洞内有个煤气灶，灶上放置一口不锈钢锅，锅内一边是红汤，一边是白汤，桌子边上是个小推车，车上放满浑浑素素，在热气腾腾中，大会正式开幕。	[6]
"开幕词由金铁歌致，第一句话是：""来，大家干！"	[]
"""杯子一举，四人杯中啤酒尽无，接着四双筷子插向热气腾腾的锅中。"	[]
第一个议题是：把人气搞上来。	[]
一直举手通过。	[]
干！	[]
突然无事佬接到一电话，接着一美女飘然而至，正是简约美眉。	[7]
简约说，不好意思，来晚了。	[]
金铁歌说，不好意思，先吃了。	[]
四条汉子敬美女一杯。	[]
简约不让须眉，乃一口饮下。	[]
第二个议题是发展步骤，首先确定近期目标是在一个月内上到胡同口，把怕是小胡同口也行。	[]
中期目标是和媒体互动，长期目标是成为市民的市民论坛。	[]
该议题各抒己见，讨论的异常热闹。	[]
突然无事佬说，啤酒太涨肚子，不如喝白酒。	[]
简约赞同，于是一瓶白酒送来。	[]
除YAGOO前日因睡眠不足，仍喝啤酒外，其余四人，进入白酒阶段。	[]
第三个议题是分工负责，各人争先恐后，勇挑重担，任务立即被分解下去。	[]
第三个议题结束是，一瓶白酒也随之结束。	[]
喝完白酒，再接着喝没喝完的啤酒，第四个议题又被拿到桌面上来。	[]
第四个议题是关于版首语，最后一致认为散会后自有想象，找到正确的定位，组织好语言，在版上在此讨论后确定。	[]
其时，啤酒已经喝完，无事佬作闭幕词。	[]
无事佬说，OVER！	[]
会议结束。	[6]
会后，代表们登上新街口天安大厦39层，欣赏了新街口的夜景，充分感受南京的美丽，为生活在这样一个美丽的城市，并为她建设地更好而感到骄傲。	[6, 26]
（无事佬）2004-3-17。	[]
我算是土生土长的南京人，虽然父辈只是随部队南下才到南京，但我可是在南京出生，在南京长大的，除了在上海当兵的十年。	[26, 21]
"我爱南京～兼答网友""最爱南京""文/无事佬我算是土生土长的南京人，虽然父辈只是随部队南下才到南京，但我可是在南京出生，在南京长大的，除了在上海当兵的十年。"	[26, 21]
在我小时候，南京除了主干道的绿化好，道路宽，再就是几个大机关、大专院校像模像样外，其它地方基本是贫民窟，特别是城北的下关区，城南的建业区和秦淮区，真正发生巨大变化的是改革开放后。	[]
可以说，这二十几来年，南京每天都在发生变化，越变越好。	[]
作为生活在这个城市的老百姓，我同样感到高兴。	[]
除此以外南京还曾是九朝古都（一说十朝），至今南京的众多名胜古迹，还被我们后人用来游览，并成为南京人的骄傲。	[]
还有就是南京的紫金山、玄武湖、莫愁湖等等，都是全国著名的风景区，每年都有各地游人前来游玩。	[26]
南京最有特色的恐怕是文化蕴底深厚，从解放初期就一直领先于全国的科技力量，众多的大专院校和科研所，数量之大，人员之多，在全国是绝无仅有的。	[]
据说在南京的院士除北京外，就数南京了，位居全国第二。	[]
再就是自嘲为大萝卜的可爱南京人，那种憨厚、淳朴、宽容、安逸的风气，是好多城市不能相比的。	[]
尽管南京人的口头语过于粗鲁，难以入耳，但和南京人的众多优点相比较，似乎又算不了什么。	[]
在南京生活了几十年，怎么说对家乡都是有感情的，同样，和所有的南京人一样，怎么说对南京也是有微薄功劳的。	[]
但是爱南京不代表不能批评南京的个别政府机关，也不代表不能批评南京的一些丑陋现象。	[]
当然这种批评是善意的，是有积极意义的，是希望南京更美好。	[]
年前大概就是盗窃高发期，许多小偷都想捞一把回家过年，尽管妹妹家这起案件很可能不是流窜犯的作案。	[]
也正因为作案的太多，警察也忙不过来，所以才会迟到。	[]
还是因为如此，所以才会破案率太低。	[]
南京的节前治安状况不容乐观文/无事佬妹妹家刚刚搞了装潢，邀请弟兄姐妹携儿带女前去参观，随便也算是年前聚一聚，热闹一把，时间定在上周日中午。	[26]
妹妹家住在南京治安状况较好的鼓楼区，只不过是老房子的一楼，容易被盗罢了。	[]
一楼有个不大的院子，出晒台大约5米就是一个小坡，坡上正是公安的警务室，从警务室看妹妹家，一清二楚。	[]
可就是这样还是出问题了。	[]
我们是12：20左右出去吃饭的，14：30左右回来，开门没发现什么，到卧室发现不对劲，橱门敞开，进去一看东西被翻的乱七八糟。	[]
这时才发现，晒台的防盗栏杆被拉开一个口子。	[]
少了多少东西不知道，首先是保护现场，报警第一。	[]
我们退出来打了110，不通，再打，还是不通，看来报警的人太多。	[7, 7]
几台手机同时拨打110，终于通了。	[7]
在等了15分钟左右，派出所来人了。	[]
没用，还要等刑警队的警察。	[]
派出所的民警在我们的催促下至少打了5个电话给刑警队，大概也是忙，还是没到。	[7]
派出所的民警说，看来不像是流窜犯作案，还是好查的，要是流窜犯，捞一把就回家过年，查出的希望就不大了。	[]
妹妹哭了，外地读书刚刚回来的外甥陪着他妈妈，并安慰她。	[26]
我和妹婿陪着派出所的民警，一位联防队员在外面等刑警队的警车到来。	[]
派出所的民警电话响了，说刑警队的民警不认识妹妹家，找不到地方，我也只好到外面去等。	[7]
一会儿，果然开来一辆挂着苏0－A××××的红色奥托警车，只有一个人带着工具箱下了车。	[]
我看了看表，时间是15：20。	[]
刑警队的警察一个人忙着现场勘探，前后忙了个把小时，然后对我们说，可以清点少什么东西了，说完他走了。	[]
妹妹家三个人清点了一下，还好，损失的现金不多，因为都用卡，仅数百元，主要是一些金银首饰和数码用品，价值也不菲。	[]
派出所的民警一一做了笔录，然后也走了。	[]
临走时说，看来破案是有希望的，因为听反映，有几个小年青中午坐在警务室门口的栏杆上盯着妹妹家的小院子，估计就是他们。	[]
快六点。	[]
我们在安慰妹妹后也回家了。	[]
第二天，我打电话给妹婿，想问问情况。	[7]
妹婿说，没有任何消息，只不过是向公安局做了投诉，刚刚公安局已派警督来调查过出警不及时的问题。	[]
至于能否破案，恐怕不敢指望了。	[]
想起来N年前，我家已被偷过一次，刑警队也是姗姗来迟，勘探过后也是毫无消息，算起来，恐怕快10年了。	[]
年前大概就是盗窃高发期，许多小偷都想捞一把回家过年，尽管妹妹家这起案件很可能不是流窜犯的作案。	[]
也正因为作案的太多，警察也忙不过来，所以才会迟到。	[]
还是因为如此，所以才会破案率太低。	[]
2005-2-5。	[]
南亚赈灾，一个呼唤“以人为本”的声音施化本世纪第一次最大的自然灾害，在一个节日降临到十五万无辜死亡者和上百万灾民头上。	[]
十多天过去，整个世界从震惊中清醒。	[]
通过报纸版面和电视屏幕，我看到无数双伸出的援助之手。	[]
各国的捐款数额直线上升，据说已超过五十亿美元。	[31]
救援人员把一袋袋食品、一包包衣物发给灾民。	[]
这些文字和画面，表达了一个非常明确的信息：人的生命，是高于一切的价值。	[]
救人要紧，其余无论什么大国利益、意识形态、种族纠纷、个人恩怨，统统是微不足道的小事。	[]
一个可能被忽视的现象：在世界主要媒体的灾难报道中，第一个强调的数字是死亡数字。	[22]
从最初的三万人，经过连续不断地追击报道，一直追加到最近的超过十五万人。	[]
并非人们不介意财产损失，但财产和人相比，人是第一位要紧的。	[]
没有人，金山银山又有什么意义？	[]
把人放在所有客观价值的第一位，这种价值观不是中国从古到今历来都有的。	[]
有时候生活中一点小事就体现出来：我的一个小学同学，用爸爸新买的自行车第一次学骑车，摔了一跤，把腿和自行车都划伤了。	[24]
她爸爸心疼了半天，不是心疼女儿的腿而是自行车。	[]
她爸爸说，腿划伤了还会长好，自行车就永远“长”不好了。	[]
同学爸爸的这种观念，当时是被社会广为接受的。	[]
两年前，中国的新领导人开始提出的“以人为本”的理念。	[]
越来越多的中国知识精英开始意识到，“以人为本”，就是处处讲求尊重人、爱护人、理解人、关心人，处处从方便、体贴、适合人的需要的角度思考问题。	[]
许多学者从教育、经济、环保等角度，来论证“以人为本”。	[]
比如，有人论证，“以人为本”作为一种价值取向，其根本所在就是以人为尊，以人为重，以人为先。	[]
当“以人为本”作为教育的价值选择时，教育便具有了创造人的价值的意义。	[]
也有人论证，就资源的使用特性而言，物质是有限的、排它的，一些人多占了，另一些人就少了；	[]
而知识则是可以共享的，使用的人越多，效用就越大。	[]
另外，一种建立在以人为本的动力基础上的经济秩序，较之用短期行为引导人的经济秩序，更可能享有持久的繁荣。	[]
在上面这些极其有价值的思考的同时，更有一些超越性思考的出现。	[]
有一位网络作者写到：“在中国，个人的自由精神依然被困在群体意识里，或者在权威面前表现集体无意识。”	[]
“追求文明的现代中国人，不知道目前提倡的以人为本，是否仅仅是以一部分人为本，或者是以好人为本，或者是以坏人为本，还是应该以人的自由精神和个体意识为本。	[]
”南亚赈灾这一2005年的全球广泛行动，给重新呼唤“以人为本”提供了一个良好的契机。	[]
中国的中央电视台一反常例，以长时间反复连续的播出频段，动员全国男女老少捐款。	[31]
有的地方的党政部门，把为南亚灾民捐款，当成政治任务层层压到基层。	[31]
既然有这样大规模赈救灾民的宣传声势，只要稍稍加上一点“以人为本”的内容，就将成为一个极好的“人性启蒙”。	[]
在这个启蒙中，中国新一代领导人“以人为本”的理念，可以通过强有力的宣传网络深入人心。	[]
西风咏墨~.2005-01-16T06:29:55一点点建议文章有思想但文字太小我要拿着放大镜看才行:）PLSENLARGETHESIZEOFWORDS。	[]
数以千计的反对派支持者聚集在塞尔维亚最大的煤矿，声缓和防暴警察对质的工人。	[5]
乘坐大客车的警察强行进入这个地方以后，至少有一万抗议民众聚集在贝尔格莱德以南的特卢巴拉煤矿。	[26]
矿工们使这个煤矿停工，他们要求南斯拉夫总统米洛舍维奇承认在最近的总统选举中失败并且下台。	[28]
反对派后选人科什图尼察对抗议民众发表讲话，强调了进行和平活动的重要性，这次罢工是反对派全国性的不予当局合作运动的一部分。	[5]
津巴布韦的警察和安全部队突袭了一家独立电台的播音室。	[4]
这家电台在上个月对政府在广播方面的垄断地位提出挑战并且获得成功，警察以及中央情报部门的人员星期三突然进入哈拉雷这家电台并且破坏了电台的设备。	[26, 4]
南斯拉夫国家通讯社南通社，把反对派领袖科什图尼察称为这个国家的当选总统。	[27]
几个小时之前抗议民众冲进议会和国家电视台大楼。	[26]
要求米洛舍维奇总统下台。	[28]
南通社表示和人民站在一起，并将真实和客观的为国家的利益作出报道。	[]
接近高级军官的消息灵通人士说，南斯拉夫军队不会离开军营去干涉反对派起义。	[26, 4]
科什图尼察对美国之音的塞尔维亚语部表示，反对派同所有的有关的国家机构建立了联系包括警方，一个新的民主政府正在形成。	[]
科什图尼察说塞尔维亚正在改变面貌，人民的意愿胜利了。	[]
