text	label
决议明确谴责以色列军队针对巴勒斯坦平民过度使用武力，要求以色列严格履行1949年联合国《日内瓦第4公约》有关保护战争平民条款所规定的法律义务和责任。	[4]
决议重申以色列在包括耶路撒冷在内的巴勒斯坦被占领土上修建的定居点是非法的并且阻碍了和平进程。	[]
决议同时对巴以17号在埃及红海城市沙姆沙耶赫达成的协议表示支持，敦促有关各方立即确实履行协议。	[]
决议通过之前，联合国秘书长安南以及50多个国家的代表在会议上发言。	[]
安南指出，沙姆沙耶赫协议的执行正处于关键时期。	[]
他呼吁巴以双方采取有效措施，真正履行各自的承诺，以结束冲突并且恢复谈判。	[4]
在过去的20多天里，以巴冲突已经造成100多人死亡，数千人受伤，死伤者绝大多数为巴勒斯坦平民。	[4, 22, 24]
中央台驻联合国记者报道。	[]
1950年6月朝鲜内战爆发。	[]
美国随即宣布出兵干涉，并派海军舰队侵入中国的台湾海峡，刚刚成立不到一年的新中国出于国际主义原则和保家为国的考虑，毅然派出了自愿军入朝参战。	[4, 26, 26]
这就是历史上著名的“抗美援朝”战争。	[]
朝鲜战争爆发以后，美国纠集所谓的联合国军在朝鲜西海岸仁川登陆，并不顾中国政府的一再警告越过三八线，占领平壤。	[26, 26, 26]
继续北犯，把战火烧到了中朝边境的鸭绿江边，面对这种形势，中国根据朝鲜的请求，作出抗美援朝，保家为国的战略决策。	[]
1950年10月19号，以彭德怀为司令员的中国人民自愿军跨过鸭绿江，开赴朝鲜战场。	[26, 26]
从10月25号到1951年的6月自愿军与朝鲜人民军并肩作战，连续发动了5次大规模战役，歼敌23万多人，把侵略军从鸭绿江边一直赶回到三八线。	[4, 22]
在自愿军入朝作战之后，中国国内掀起了大规模的抗美援朝运动，中国人民在当时条件较为艰苦的情况下，发起捐献飞机大炮的活动，仅从1951年6月到1952年5月不到一年的时间里就捐献了可以购买3170架战斗机的款项。	[26, 31, 31]
从1951年7月起，美国一方面同中朝进行停战谈判，一方面继续扩大战火。	[6]
在多次进攻和狂轰烂炸都没有奏效之后，美军竟然不顾《国际公约》的禁令使用细菌战。	[4, 4, 4]
引起全世界的公愤。	[]
1953年7月27号，美国在难以挽回败局的情况下，被迫从新回到谈判桌前，在板门店同中朝签定了停战协定。	[6]
在历时3年的战争中，中朝军队共歼敌109万人，其中美军39万人，击落击伤敌机12200多架，自愿军伤亡36万人。	[22, 24, 22]
朝鲜停战之后，中国人民自愿军又帮助朝鲜人民为战后的恢复和建设做了大量的工作。	[]
1958年10月中国人民自愿军全部撤离朝鲜返回祖国。	[26, 26]
由文化部选派的中国18岁选手李云迪在第14届“肖邦国际钢琴比赛”中获得金奖，这也是中国选手在该项比赛中首次获得金奖。	[]
在首都国际机场李云迪受到人们的欢迎，这位刚满18岁的高三年级学生成为中国第一位获得冯德德里克“肖邦国际钢琴比赛”金奖的选手，“肖邦国际钢琴比赛”始于1927年，是与柴科夫斯基齐名的国际上艺术水准最高的赛事之一，每5年举办一次，1990年和1995年，“肖邦国际钢琴比赛”金奖空缺，今年来自25个国家的98名选手参加了比赛，经过激烈的角逐，李云迪以无可争议的成绩夺得了金奖，成为10年来“肖邦国际钢琴比赛”第一个获得金奖的选手，中国另一名选手陈萨获得第四名。	[]
中央台报道。	[]
在10月26号召开的“21世纪公务员管理国际研讨会”上，中国人事部部长宋德福表示：中国将进一步完善公务员制度改革，真正建立一个廉洁勤政、务实高效的政府，为民众服务。	[]
中国人事部部长宋德福向与会代表介绍说：“中国的公务员制度改革始于1993年，经过近年的发展目前已经建立了泛竞避口、公开招聘、竞争上岗等国家公务员制度，公务员首次实现了岗位轮换、晋级增资和辞退，并逐渐形成了以国家公务员暂行条例为主的法规体系”。	[]
人事部部长宋德福表示：面临新形势，增强公务员制度的活力和提高公务员素质尤为重要。	[]
因此下一步中国将着重在制度上进行创新。	[]
“坚持在完善发展中创新，完善考录进岗制度，试行委任与聘任相结合的新的任用制度。	[]
”宋德福说：“在制度创新的同时，中国还将推行社会化公开性服务，让公众少跑机关、少等时间，并公开办事程序，接受公众监督。	[]
来自美国、英国等近十多个国家和地区的政府官员及专家学者参加了本次研讨会，大家围绕21世纪的公务员管理这一问题进行多方位的研讨。	[]
“美国和中国在公务员管理上实际上都面临相同的问题，比如说全球化和信息化，所以说公务员制度改革的最终目的就是精简机构、提高效率和为民众服务。”	[]
“21世纪公务员的发展是个全球性的问题，加强各国间的交流与合作，在借鉴中寻求发展是我们共同努力的方向。	[]
”与会者认为：公务员的管理已经成为各国政府改革的一项重要内容，它所涉及到的政府职员工资、聘用、工作人员调整等方面将直接关系到政府效率、活力和竞争力。	[]
中央台记者报道。	[]
澳门特区行政长官办公室、各司长办公室、行政会以及政府总部、辅助部门将从30号起从原来的临时办公处迁出，正式在政府总部办公。	[26]
澳门特区政府总部位于前澳督府及政务司大楼，由三座建筑物和花园组成，面积约1万平方米，经过近7个月的修缮，建筑物外观基本保留原有风格，对内部年久失修的天花板和下水道依照消防和现代技术要求进行重新改造，而具有殖民色彩的照片等物品已送往澳门博物馆收藏。	[]
修缮改造后的政府总部整体给人以明亮、简洁、大方的感觉，其中改动最大的是原立法会主席办公室现在改为待客厅，并在厅内鲜花装饰立体莲花图案，成为最具澳门特区色彩部分。	[]
另外还新开辟了记者室，安装了传真机等设备，为记者提供方便。	[]
据了解特区政府原来临时所使用的宋裕生广场办公用房将尽快退租交还业主。	[]
中央台驻澳门记者报道。	[]
俄罗斯总统普京29号抵达法国首都巴黎，这是他就任总统以来首次以法国进行正式访问。	[26, 30, 26]
法国农业部长格拉瓦尼前往机场迎接普京，普京当月30号在巴黎参加由欧盟轮值主席国法国主持的欧盟俄罗斯首脑会议，会议将动员讨论改善双方经济关系，并涉及中东局势等问题。	[26, 6]
据悉，本次会议将有助于俄罗斯实现其加入世界贸易组织的目标，但欧盟官员表示：本次首脑会议不大可能提出重大倡议。	[]
中央台编译报道。	[]
在中国的农村房屋、土地，赡养老人等问题经常会引起纠纷，为了解决这些矛盾，乡镇司法调解中心应运而生。	[]
中国司法部对这一符合中国民情的作法表示肯定，并准备在2年内采取得力措施，在中国的5万个农村、乡镇全面建设司法调解中心。	[3]
据了解，通过这一机构取得良好的社会效果是山东省德州市临县和江苏省彝黄县，当地政府官员表示，由多个办事部门共同组成的司法调整中心成立仅1年后，就快速有效地为农民调解各类纠纷1500多起，结案率达到95%，同时找上级政府告状的案件下降了65%。	[3, 19]
“司法调解中心它的作用，它不仅仅是息事宁人了，它很重要的就是建立一种新机制，疏通了我们政府同群众之间的这种渠道和桥梁。”	[]
“法律调整中心，它能够，它起到了给老百姓说法呀、读法呀，让大多数的农民兄弟能够掌握法律武器呀，用法律武器来捍卫自己的尊严，捍卫自己的人格。	[]
”据了解，目前中国已建成乡镇司法调整中心2万多个，约占乡镇总数的近44%，中国司法部认为，乡镇司法调解中心的设立符合中国的国情和民情。	[3]
“乡镇司法调解中心的建立和开展工作，是司法职员的一种节约，也就是说观念、性质之前的调解事情搞好了，自然案件也就少了，从这里来讲呢，对社会稳定来讲，是件好事。	[]
”高长宇透露，中国各级司法机关今后将投入更多的精力和物力用于加强司法调解中心的建设，使中国各地农村民间的调解走向法制化、规范化。	[]
中央台和山东德州台报道的。	[]
朝鲜同美国就导弹问题举行的第二次会谈3号在马来西亚首都吉隆坡结束，双方在主要问题上没有达成协议。	[]
美国在会谈中希望朝鲜承诺，停止试射远程导弹，限制向巴基斯坦和一些中东国家出口中、短程导弹。	[32]
美朝双方还讨论了由此产生的对朝鲜的赔偿问题，并深入探讨了用帮助朝鲜发射卫星作为朝鲜限制其导弹发展的交换条件。	[]
美国代表团团长爱因霍恩在会谈结束后发表的一份声明中说，会谈涉及了朝美两国共同考虑的关于导弹的全部内容。	[]
双方进一步澄清了各自对导弹问题的立场，并将继续扩展共同关心的领域，但主要课题还有待进一步的讨论和解决。	[]
朝美曾于今年7月在吉隆坡举行的第一次导弹会谈。	[]
中央台编译报道。	[]
珠海航展作为一个国际性的航空、航天博览盛会至今已经举办了三届。	[]
现在我们来介绍一下前两届珠海航展的情况。	[]
首届珠海航展于1996年11月5号举行，400多家国内外航空、航天厂商的代表，以及96架中外军用、民用飞机集中亮相。	[]
在那一届的航展开幕式上，中国政府宣布从1996年开始，每逢双年在珠海举行“中国国际航空、航天博览会”。	[]
在96年航展期间，共达成16个项目，近20亿美元的合作和协议，70多万观众前来参观，1500多名中外新闻记者报道了这次盛会。	[]
1998年11月15号到22号，第二届珠海航展举办，同第一届相比，这届航展展出规格更高、规模更大，展品竞技性和技术难度更强。	[]
来自25个国家和地区的近500家航空、航天界厂商参展。	[]
参展飞机达100多架。	[]
在这一届的航展上，中国、英国、俄罗斯等国的飞行表演队还展示了高超的飞行技巧。	[]
除了珠海航展之外，世界范围内还有10多个国际性的航展，其中最著名的是法国巴黎航展、英国范保罗航展和新加坡航展，它们是当今世界上规模最大、影响也最大的航展，并称为世界上“三大航展”。	[]
我们来作进一步的了解。	[]
巴黎航展是世界上规模最大、历史悠久的国际航空、航天展览会，每两年举办一次，在单数年的初夏举行。	[]
第一届巴黎航展于1909年9月开幕，至今已经举办了43届。	[]
第43届巴黎航展于1999年6月开幕，是历届航展中规模最大的一届。	[]
46个国家的1900多个厂家参展，参展飞机有230多架，并且有一些先进飞机进行了飞行表演。	[]
两年一度的英国范保罗航展是规模和知名度仅次于巴黎航展的世界第二大航展，展览会场范保罗位于伦敦西南的一个小镇。	[]
英国最早的航展，可以追溯到1920年开始的系列称为航天庆典的活动。	[]
1948年航展移到范保罗举行，以后每年举行一次。	[]
1962年以后，航展改为每两年一次。	[]
1998年范保罗航展是最后一次在传统的9月的第一周举行，从今年起航展的举办日期改到7月份。	[]
新加坡航展是由亚洲航空、航天展览公司组织的亚洲国际航空、航天博览会。	[]
与此同时还举办亚洲防务技术展、亚洲机场设备和技术展。	[]
首届新加坡航展于1981年举行，到2000年已经成功举办了10届。	[]
90年代以来，马来西亚利马航展、中国珠海航展、韩国汉城航展和印度航展先后问世，此外国际舞台上，还活跃着阿联酋迪拜航展、德国伯林航展、加拿大航展、俄罗斯航展和澳大利亚航展。	[]
中国前不久出台的电信条例当中对从事增值电信业务经营者的出资比例及所有制性质等等没有作出特殊的规定，这就标志着中国增值电信市场全方位开放，只要符合条件的经营者都可以经营增值电信业务。	[]
增值电信业务是指利用公共网络基础设施提供的电信与信息服务的业务，包括：互联网服务中的运营商、服务商以及诸如可视电话、语音信箱等电信业务，业务范围广泛，市场潜力巨大。	[]
在新颁布的电信条例中规定，经营增值电信业务应当具备的条件有：经营者为依法设立的公司，有与开展经营活动相适应的资金和专业人员，有为用户提供长期服务的信誉和能力以及国家规定的其它条件。	[]
“国内的非国有经济成分，包括私营经济成分，100%投资设立公司来经营增值电信都是允许的，也没有，没有禁止。	[]
当然对外资进入中国的增值电市场，我们已经在中美会谈当中，在中英的会谈当中都作出了承诺。	[6, 6]
那么我们将根据我国和wto签署的最终协议，有计划、有步骤的放开我们这个中国电信市场。”	[]
中央台记者报道。	[]
巴勒斯坦民族权力机构主席阿拉法特5号决定接受美国总统克林顿的邀请，将于9号对美国进行正式访问。	[26]
阿拉法特的政治顾问拉迪纳宣布说：巴方认为阿拉法特的华盛顿之行，对于挽救巴以和平进程具有重大意义。	[26]
他同时称，阿拉法特还将同克林顿讨论以色列对巴勒斯坦人民的持续侵犯的问题。	[4]
阿拉法特是在4号会见美国驻耶路撒冷总领事时收到克林顿的正式邀请的。	[6]
据悉，克林顿同时也向以色列总理巴拉克发出了类似的邀请，巴拉克可能于12月访美。	[6]
另据报道，当天在加沙地带和约旦河西岸地区仍有零星的冲突发生，已经造成了2人死亡，10多人丧生。	[4, 22, 22]
以色列军队同巴勒斯坦枪手之间的猛烈交火，从4号晚一直持续到5号上午，形势仍然十分紧张。	[4]
在西伯伦市中心的犹太人定居点外，巴勒斯坦示威者与警察发生了冲突。	[4]
以色列总理巴拉克5号在以内阁每周例会上表示：尽管以巴双方连续4周发生流血冲突，以色列仍将充分利用每个机会力争与巴勒斯坦就最终地位问题达成协议。	[4]
同一天以以色列前总理拉宾命名的一座公园在法国巴黎落成，以色列地区合作部长前总理佩雷斯在落成仪式上发表讲话指出：和平是以色列的唯一出路。	[]
中央台编译报道。	[]
我们再来看一组国际综合报道。	[]
日本邪教组织奥姆真理教，一位前高级成员6号被日本东京法院判处8年有期徒刑。	[18]
现年48岁的大内力育曾经是奥姆真理教俄罗斯支部的负责人，他被控于1989年同其他几名成员一道将一名试图脱离这个组织的21岁的成员谋杀。	[11, 22]
此外他还在一项试验中，参与秘密焚毁这一组织另外一名成员的尸体。	[]
本台消息：美国行政当局最近签署了美国国会参、众两院通过的，含有多项反华条款的《2001财联对外行动拨款法》。	[]
该法案利用台湾人权、西藏等问题，粗暴干涉中国内政，损害中国利益。	[]
中国全国人大外事委员会负责人10号发表谈话，对些表示强烈愤慨和坚决反对。	[]
这位负责人说：美方不顾中方的坚决反对，公然违背《817公报》的规定，不仅没有减少和停止售台武器，反而变本加厉的向台湾出售先进武器。	[32, 32]
无论在数量上和性能上都远远超过当年的水平，这不仅严重侵犯了中国的主权，而且助长了台湾岛内台独势力的嚣张气焰，导致台海局势的紧张，阻挠中国的和平统一。	[]
美方应充分认识到，美售台武器的严重危害性，切实恪守中、美3个联合公报和有关承诺，立即停止售台武器。	[32, 32]
该法案还公然违反国际法准则，以各种借口支持从事分裂中国活动的分子和其他敌对分子，我们对此行径表示强烈谴责。	[]
全国人大委员长李鹏近日在湖北宜昌市考察三峡工程建设时强调，要以改革的精神推进三峡工程建设，以现代化管理模式探索中国水力、水电发展的道路。	[]
要以对全国人民的责任感和建好天下第一大坝的光荣感搞好三峡建设。	[]
李鹏强调：三峡工程是世界上最大的工程，受到全国全世界的关注。	[]
质量是工程建设的生命线，要克服困难完善我们的质量监督体系，把三峡建设成世界上一流的工程。	[]
李鹏说：今后三年内，三峡施工任务将更加紧张，工程的难度也越来越大，技术要求也越来越高，因此要树立质量第一的观念。	[]
在这样大的工程建设中，不可能不出现一点问题，要敢于面对困难，总结经验教训，加强管理，在保证质量的同时保证工程如期完工。	[]
他指出：要以改革的精神进行三峡建设。	[]
改革的目的是为了发展，是为了提高效益。	[]
三峡建设要勇于探索，在现代化施工方式，资金筹集，移民安置，人才培养等方面走出自己的路子，逐步实现流动发展。	[]
考查期间李鹏还会见了参加三峡工程建设的四位外国专家，他们是来自奥地利的拉贝勃和罗伯特，来自法国的马里奥，来自美国的科格哈墨特。	[6]
李鹏说：随着三峡工程的进展，将会有更多的外国专家前来参加建设。	[]
他希望外国专家们大胆工作，严格要求，与三峡建设者们密切配合，共同建设好三峡。	[]
几位专家表示，能参与这项世界上最大的水电工程建设感到非常荣幸。	[]
他们认为，三峡工程的组织工作十分出色，质量也相当好，会成为世界水电工程史上的一个典范。	[]
他们表示将全力投入这项伟大工程的建设。	[]
三峡工程自1997年11月8号实现大江截流，标志着三峡工程第一阶段建设任务顺利完成，进入以主体施工为主的第二阶段。	[]
1998年建成二期围延并且经受了长江八次洪水的考验。	[]
1999年实现了主体工程施工从大规模开挖向大规模混凝土浇铸的转移。	[]
并且创造了混凝土浇铸458万立方米，月浇铸55.4万立方米的世界大坝纪录。	[]
2000年是三峡工程的大坝、发电厂房和船闸工程混凝土施工的高峰年，大坝接缝灌浆也将全面开始。	[]
金属结构和机电埋件进入全面安装的阶段。	[]
到2003年，三峡工程将完成第二阶段目标，实现水库初期蓄水，首批机组发电和永久船闸开始通航。	[]
中央台记者报道。	[]
针对13号约旦河西岸和加沙地带以巴局势急剧恶化以色列内阁13号决定以色列国防军自当晚起，对约旦河西岸由巴勒斯坦控制的a区和加沙地带实施全面的封锁。	[]
目前持续近两个月的巴以冲突已经造成了214人死亡。	[4, 22]
封锁期间任何巴勒斯坦人和车辆不准擅自离开a区和加沙地带。	[26]
13号约旦河西岸和加沙地带发生多起流血冲突，造成4名以色列人和4名巴勒斯坦人死亡，另外有8人受伤。	[4, 22, 24]
此外，巴勒斯坦持枪者还与以军在吉洛发生激烈的交火。	[4]
巴勒斯坦的一所学院遭到以军的炮击，学生们只能在帐篷中上课。	[4]
而在以色列孩子们则在窗外堆满沙袋的屋中学习，终日生活在恐惧中。	[]
日本大阪地方法院13号做出判决，要求以毫无科学根据的脚相诊断为手段，骗取钱财的邪教——“法之华三法行”对大阪府16名受骗男子赔偿1.1亿日元。	[31]
这些男子在向法院提出的财产赔偿诉讼中说，从1992年开始，“法之华三法行”教团成员，以看脚相的方式恐吓他们已身患癌症，骗取了20万到3000万日元不等的研修费。	[31, 19, 31]
另外福冈地方法院、邱田地方法院也正在审理要求“法之华三法行”教团进行财产赔偿的诉讼案件。	[31, 19]
目前日本全国有1200多名受害者提出诉讼，要求赔偿的总金额超过65亿日元。	[19, 31]
“法之华三法行”教团多年来通过给人看脚相占卜，以不治之症和难逃劫难相威胁，诱骗人们入教，并以各种名义要求修行者缴纳巨款。	[31]
法院已经立案，并对这个教团里的一些骨干进行了有罪判决，中央台编译报道。	[12]
中外对外贸易合作部部长石广生17号在斯里巴加湾市对记者说：刚刚结束的亚太经合组织第八次领导人非正式会议，及此前的部长级会议取得了积极成果，他对会议的结果感到满意。	[]
石广生和龙永图还介绍了中国加入世贸组织等有关方面的问题。	[]
石广生表示：2001年，中国将承办亚太经合组织第九次领导人非正式会议，及一系相关会议活动。	[]
中国将在今年文莱会议的基础上，继续加强成员间的合作，推动合作进程。	[]
为亚太地区和世界的经济发展与繁荣做出贡献。	[]
关于中、美多边贸易的磋商石广生说：这次磋商不是双边磋商，中美双边磋商的协议已经在去年11月15号正式签署。	[]
为加快在日内瓦进行的多边谈判进程，中美双方在文莱就中国加入世贸组织协议书条款的文本问题进行了几次磋商，取得了重要进展。	[]
在许多问题上达成了共识，但还有一些问题有待进一步磋商。	[]
中国对外贸易经济合作部首席谈判代表龙永图介绍了中国和墨西哥，关于中国入世的谈判的情况。	[]
他说：中、墨是友好国家，墨西哥是一个发展中的大国，中国在入世谈判过程中得到了墨西哥的支持。	[]
双方在北京、巴黎、日内瓦已经进行了多次气氛友好和建设性的谈判，目前还有一些技术性的问题有待于解决。	[]
龙永图说：墨西哥方面针对中国产品的反倾销措施是违背世贸组织规则的。	[]
双方正在就减少这些措施的过度期问题进行磋商，但这并不影响中国入世的大局。	[]
中央台记者报道。	[]
美国共和党总统侯选人布什22号就有关佛罗里达州总统选票统计的诉讼案件，向联邦最高法院提出上诉，要求该法院对人工重新记票进行干预。	[19, 19]
佛州最高法院21号晚上作出判决，允许该州棕榈滩等县的人工重新记票结果记入大选总票数中。	[]
布什在判决后就此提出了上诉。	[19]
上诉书说，本案涉及宪法赋予选民的最基本权利，如果联邦最高法院不能作出阻止人工重新记票的裁判，那就可能给新总统的合法性带来问题，甚至造成宪法危机。	[19]
22号也发生了一件令布什竞选阵营高兴的事，佛州人口最多的迈阿密戴德县的选票统计委员会以无法在州最高法院确定的截止日期27号上午9点前结束记票为由，突然决定停止该县的人工重新记票工作。	[]
戈尔选举阵营立即向佛州第三地区上诉法院提出上诉，称该县的决定公然违抗州最高法院的一致判决，但是这一上诉在当天夜间被该法院驳回。	[19, 19]
另据医生的证实，布什的竞争伙伴前国防部长切尼确实患了轻微的心脏病，并且做了一个历时2小时的心血管扩张手术，目前康复良好，很快就可以出院。	[26]
切尼10年前曾犯过3次轻微的心脏病，他于22号凌晨因为胸部痛疼住进了乔治华盛顿大学医院。	[26]
中央台编译报道。	[]
泰国警察23号在缅泰两国交界的北必佛省顺利的解决了一起人质危机，击毙了9名越狱的逃犯，从他们的手中迎救出了3名被劫持的人质。	[4, 22]
这9名逃犯是22号从曼谷西南40公里的一所监狱越狱的，他在逃跑的过程中还劫持了包括监狱长在内的数名人质。	[26]
泰国警方在与逃犯谈判后允许他们带着人质乘坐1辆轻型卡车逃跑，警方一直紧随其后，最终顺利击毙逃犯，结束了21小时的人质危机。	[4, 22]
除了典狱长头受伤晕迷之外，其余人质安恙无样，另外有一名警察在交火中受伤。	[24, 4, 24]
警察在1名被击毙的逃犯手中发现了1枚手榴弹，并且在搜查罪犯车辆时，又发现了一些匕手和2枚手榴弹。	[4, 22]
中央台编译报道。	[]
1月27号中国科学院院士、原复旦大学校长杨富家教授起程赴世界著名大学英国诺丁汉大学就任校长。	[30]
由中国教育家担任外国大学校长，这在中国历史上还是第一次。	[30]
今年64岁的杨富家教授1958年毕业于上海复旦大学，是中国著名的原子核物理学家和教育家，1991年当选中国科学院院士。	[27]
